Initial Text,Response Text
messed up dream job interview,heya really sorry about your interview and about the toxic relationship but glad youre out of it it sounds like you are having very hard time get it this is tough year regardless but it really seems like youve been suffering some severe depression and hope this helps had no direction through my teens twenties and early thirties was working meaningless minimum wage jobs and quitting when got too depressed and stopped caring an artist and writer and when was younger thought that my path would follow those went to college and got few degrees as backup but didnt follow through with either path and wasnt happy making money with my art or writing to me making money removed the passion tried moving into my own apartment to get new start but my mom guilted me into coming with as she was losing the house after my dad died anyway so was stuck with the same shit been running from working without passion and falling deeper into depression and was so miserable that didnt recognize myself and looking back to that time in my life now can see that was passively suicidal but when was got call from job never would have imagined was my dream job because it was so far from the ideas had for myself now and have been working at my dream job for two years come july it gave me the opportunity to move away and making enough money now to live comfortably guess my point is that the dream job now might not be the dream job in the future youve gotta hang on for the next dream come true because you never know what will come the position youre in right now is not forever promise feel better my friend
how to ask someone to not make jokes about suicide,say so something like listen know that making jokes is sometimes way to cope right now this is really triggering for me though please don make jokes about suicide in front of me will have to put some distance between you and if you can do that in order to keep myself safe
ever feel like fixing things wont help,it never achieves perfection but it becomes good enough
how do tell my family having suicidal thoughts,if you or someone you know is contemplating suicide please reach out you can find help at national suicide prevention lifeline usa us crisis textline text home united kingdom trans lifeline others
sometimes wonder if im supposed to exist,does existence assign meaning to us or do we assign meaning to existence
may have depression and anxiety,that definitely sounds like depression to me and anxiety does tend to go hand in hand with it although one is usually stronger than the other for me it was anxiety that picked up on first glad you re planning on contacting someone if you catch it sooner it easier to keep it from developing harmful habits in your life are you planning on getting therapy soon
do have disorder,if you want to better understand your feelings you can talk to therapist about it but if you re feeling lonely you can pm me of reply to this thread
its starting to get to me again,hey it always good to remember that the bad days won last forever know you re feelin real crummy right now but the depression will lay off soon promise you you truly are talented and skilled person no matter how your mind lies to you during this mental slump focus on some self care for the time being give yourself some rest and peace that you deserve because you do deserve it the productivity will return sooner or later
got diagnosed with depression today,read as much as you can about the most advanced literature on thw topic or at least try to inform yourself as much as you can about this whole deal
withdrawing from my life,the world isn going to be like this forever travel will begin again companies will evolve into their post covid design and begin hiring again the current situation is an anomaly and isn an indicator of how your life will be in five years
how do stop cycle of self abuse,hi there these cycles are familiar to me theres an approach to recovery called dbt dialectical behavioral therapy thats focused on identifying challenging and ultimately replacing harmful coping mechanisms with healthy ones you can do the exercises with therapist friend or even on your own unlike other approaches or theories dbt relies on doing written work which helps our brains process information in new ways also recommend finding virtual support group as hearing from and sharing with people who at least kind of get it can be very powerful experience to find free groups you can search the websites of nami national alliance on mental illness and the dbsa depression and bipolar support alliance best wishes
how to get motivated while being depressed from isolation,already had mild depression before covid and the pandemic has made it worse the onset of cold weather doesn help either what seems to help make basic physical and emotional needs the first priority especially if there is any concern of developing severe depression esp the sleep all day kind make it priority to eat fairly healthy get good sleep get some amount of exercise go outside sometimes get dressed keep your living space non gross interact daily with any friends or others online etc this will give you better and more stable baseline to work with make plan for addressing any major weaknesses that you may have in terms of self care get telehealth therapy if you are interested in professional help for me do better at motivation when have long term post covid plans and goals to strive for may not feel like doing the tasks involved but it does feel good to do my daily time investments or planned daily weekly baby steps toward those long term plans and goals sometimes start task or activity without feeling motivated but the act of starting something is enough to trigger some working amount of motivation make and stick to daily schedule doesn have to be all day or complicated or productive just create some routines if you don have one lower your expectations of life during the pandemic you likely won have your happiest or productive years for bit lots of people are struggling right now it normal do the best you can to take care of yourself and live your life despite the depressive feelings
just need some advice or help guess,hi first of all keep in mind that this voice is your own voice and it would never gonna go away you dont have to fight against it you have to learn how to live with it its hard not gonna lie but you could start with some little stepts for example have very low autoestim and when someone compliments me my inner voice start with this guy girl is lying to you youre not pretty youre ugly he she is mocking you well started to ignore it and just say thank you to the ones who compliments me and it work most of the time at least didnt hear the inner voice is like it gets tired of me ignoring it so it find another ways to ck me but not with that you should get some confidence of yourself maybe you arent like your friends but that is fine have friends who are very different from me and that doesnt mean dont deserve them eg one of them is very intelligent guy always gets grades more grade but thats fine if you do your best and learn to your own time its great you could ask your friends why are your friends and they would tell you and then you could see its nothing related to grades or same fields etc little last advice go and see therapist good luck
think about suicide too often and thing the end of my relationship may be the end for me,your situation sounds lot like me years ago was struggling lot with depression had year relationship that was long distance for the last years that was starting to fail was thinking about suicide lot and was on antidepressants and in therapy even though was chasing my dream career in wonderful city felt overwhelmed and alone and was sad all the time could feel the relationship breaking and it felt like my girlfriend was the only thing that was really good in my life so gave up my job and moved to her state to save the relationship mistake was too late few months later she dumped me years down the drain just like that it felt like had lost everything felt betrayed abandoned empty and worthless didnt do much for several months except cry sleep and try to figure out how it all went wrong and how to win her back thank god for my family or likely wouldnt be around to write this comment eventually picked myself up enough to move back and start chasing my dream again wasnt happy about it at all but did it anyway that was year and half ago still dealing with depression still feeling hurt and alone still have days when wake up from dream about my ex and cant help but cry over everything ve lost theres still times when all can think is that broken ll never be happy again and dont deserve to be anyway but ve learned that even without her even with depression theres life worth living theres little tiny pieces of joy to be found if you can look past the overwhelming sadness theres meaning and value in human existence even if its suffering still dont like my life still dont much like myself but might someday and going to stick around to find out sharing this story to tell you few things one fight for your mental health get professional help if you can keep your family and friends close if they are good people and care about you most likely they will save your life two fight for your relationship even if it feels like you cant do anything right dont become defeatist dont accept the illusion that things cant get better if you fall victim to that thinking itll become self fulfilling prophecy and youll hate yourself for it three and most important even if the relationship does end its not the end for you many times before my breakup felt things could be going that way and it was almost comforting in sick way like once she was gone could finally just go through with it and stop the suffering like she would be better off and could rid the world of my contemptible existence win win but those are just thoughts the mad ravings of diseased brain thoughts can change so can feelings even if it feels like they wont they can basically your worst case scenario here and telling you youre going to make it good luck
it still hurts that she chose someone else over me with all the love have given how do move on from that am unable to hate her,hi im sorry about what ur going through have had my fair share of toxic relationships in the past sometimes when you are with someone all you see is the good in them and your brain just blocks out the bad until time passes and you reflect and realize how they really treated you know everyone says this but time really does help you are unable to hate her now but your emotions will change as time goes and there will be new people to meet along the way the pain is bad at first but promise it will go away and you will find someone who you deserve to be with and treats you right also remember to love yourself first too everything will work out
relying on others happiness,why not start hanging out with your friend friends they likely have similar interest and personalities as your friend
screwing up in college again and need help on what can do,just guy going through something similar to you and dont know anything can say to make you feel better but something always try to remind myself to not fail college for the third time even though hate it is that the work and the degree that doing this for can only help me get out of the situation thats making me depressed it cant hurt me only help me and thats worth struggling through these days that make me feel like shit the future will come and when it does can either have this work over with and have degree that can help me move forward or can be in the exact same situation having made progress
have no one to vent to,have tried polyamory and monogamy and what concluded is this monogamy has greater tendency towards stability monogamy lets you focus and dig and find more depth in the love for the other person polyamory allows you to vent better you emotions as you can choose which person pays you better attention polyamory lets you have better sex because you dont have to wait on the other person nor you have to resolve any current problems to advance in the intimacy polyamory creates this power positions because nromally there is one person that has more access to partners making the person with less access feel more pressured and less emotionally stable monogamy is kind of boring because it is not derived from constant change but constant order as you can tell not fan of polyamory because in the end everyone gets hurt
please tell me that it will be alright and just like the good time have passed so will the sad times,this too shall pass know it doesnt seem like it right now but will get through this we need the bad sometimes to recognize the good you arent alone
feeling blue with no reasons,you are doing so good already just noticing and having that awareness is vital so many struggle to get there even with therapy am sad because of problems in my life or am noticing problems in my life because sad highly recommend exercising on top of doing nice things for yourself getting some sun getting some extra sleep anyone could use some therapy so maybe keep searching for the right one for you dont settle for less though for example if one tries to prescribe pills dont think need maybe try another therapist
help finding therapist psychiatrist,hi there you can look on the website for psychology today to find local providers or find local nami national alliance on mental illness office helpline near you to help you find folks near your friend their national helpline is if you have trouble finding local sites numbers also recommend peer support groups which nami can help with as well best wishes
when anxiety and depression take over,yep that is why people at nofap talk about how you gotta go zen mode
reddit permanently suspended my account going to appeal this every single day until they let me have it and will not give on this,dude get some professional help this isnt healthy
has anyone with bipolar disorder tried mushrooms to treat their depression,idk about mushrooms but do know cbd has helped my depression and anixety alot have pen that take with me everywhere and it really helps
how to help treat depression due to loneliness in pandemic,volunteer food bank animal shelter could be social but low contact
depression and people you are with,think that you may just not need to be around that group of people because not everyone is like that
the wisdom collector lessons in happiness,over million people from around the world are taking course on happiness since the beginning of the coronavirus pandemic the science of well being taught by the psychology professor laurie santos has become the most popular course in yale years history since march the happiness course is available free online on coursera and millions of people have already enrolled on it can happiness be learned is it question of genes or we have control on it is happiness luxury during the pandemic how could we boost our well being when we are stuck at home and how covid will affect our mental health in long term asked these questions laurie santos
could have depression,aw that was me felt tired and procrastinated im trying to fix it and doing pretty okay now wish you the best
is this all my life is,depression is horrible disease it convinces you that you re worthless and burden and that life isn worth it you need to remember that these thoughts are not you they re your disease ve been battling depression over half my life it taken family friends therapists psychiatrists and meds but can guarantee things get better sure your mother loves you dearly and does not see you as burden keep up with your meds and medical care sometimes therapy works great sometimes not personally like just talking to my psychiatrist times year and taking medication over therapy some people are the opposite you ll find what right for you it takes some shopping around but it worth the effort self care is also important try doing one nice thing for yourself each day watch show you like read or look at hobbies staying busy is great strategy you ve got this you really do
near breaking point,hey you sound like you have lot going on find something that you are able to express your stress in that works for you yes it won help with the job search but it sounds like you could give yourself break and you can come back sharper take it easy on yourself
after stopped caring everything felt better,its cost me the one thing that still held interest for me and im relapsed into alcohol and cigarettes but cant care anymore or god knows what would do serves me right for trusting
just wish meant something,maybe you should try talking to your boyfriend you obviously mean lot to him anyway how can you expect to have strong relationship if you hide how you feel and what you re thinking trust me withdrawing into depressive thoughts and isolating from the people you love is the worst thing you can do find one person you trust and let some sunlight in on the dark thoughts the ugly thoughts it the only way to scare them off on meaning think everyone has meaning and value just by virtue of being able to think and perceive the world to act to be consciously aware even if nobody else knew you existed that would still be there you ll always have it until the day you die life may feel purposeless now but that can change and you have lot of time to change it most likely your life today is nothing like your life five ten years ago and your life will change just as much in the next five ten years try to enjoy what can of my life right now even though depression makes it an uphill battle every day just to smile about one thing but know that could change someday and going to be there when it does if you really don want to talk to anyone you know in real life you can talk to me ll be here to listen
living with depressed parent,hey my mom also has severe mental health problem and understand how hard this is for you you are very brave and it is lucky for her to have you in her life for me it is change of perspective that helps me live with this reality often see my mom as person who is sick just like everybody else with cancer diabetes heart problems you name it depression is very tricky because its symptoms are reflected in persons behaviour and mind not the body and so we often think it is possible for person to feel better and try harder because human can control their mind and behaviours when in fact people with depression arent actually able to like we dont tell asthma patients to feel better without giving them treatment and helping them thats the scary part of depression the illness ruled their mind and soul you mentioned how she is unwilling to help herself it is simply because she cant and she doesnt know how to get out of there my way of handling my moms problem is to give her something to live for my mom is really looking forward to seeing me become mother one day and that is what keeps her alive and always tell her to wait for that day to come and am eager to have her participating in my future what also do is that started exchanging one thing that happened today made me happy grateful with her it was really really hard for her to come up with such small thing at the beginning but dont stop encouraging her give her example like dont you think brushing your teeth today make you feel good am so happy to hear you took your med today it sounds stupid to even cheer for such little things but thats exactly what they need simply positive reinforcement to help them get back to normal and start to appreciate the smallest thing around them just like how we dont give up on an asthma patient when he she having an attack dont give up on her having her low moments either even though they happen all the time all these little things work for me because she started to try to take care of herself and am not saying its easy because too because of constantly worrying her her being constantly failing started to feel depressed and hopeless it is an extremely hard battle harder than anything that encountered and will encounter just remember it is the illness that steps between you and her and you are not fighting each other but the illness depression patients always have better treatment outcome when there is are someone supportive in their life and its true let them know its okay to feel sad sluggish and dont punish them for misbehaving instead only reward their good behaviours with positive responses am proud of you because am really happy to hear you you did great thing taking care of yourself even though they are deep in dark place they can still feel love and encouragement and you are doing great because you are not giving up yet even though we are complete strangers am still very very proud of you for your choice of moving back and helping her
think need hug,hugs hope its not too late needed hug too
someones going to delete this,out of curiosity why was your other account suspended for moment forget about how depressed you are tell me something about yourself what is the weirdest thing you ve seen recently what random shit do you find yourself fascinated by on youtube once when was really ill for few months got caught in youtube wormholes and ended up watching hours of engineering disaster documentaries was obsessed what about you
maladaptive daydreaming,hi there dont know anything about maladaptive daydreaming but what youre experiencing sounds like they could also be described as intrusive thoughts ruminations which are symptom of anxiety and depression not only are you unhappy with where you are but your brain tells you that its your fault or that youre trapped or that you need to think your way out of it or all of the above highly recommend peer support groups to you as well as looking into cbt cognitive behavioral therapy and or dbt dialectical behavioral therapy perhaps with friend or counselor these models were created explicitly to help folks challenge intrusive thoughts and learn to create coping strategies as for the groups you can look on the websites for nami the national alliance on mental illness or the dbsa depression and bipolar support alliance to find virtual groups near you or not near you hearing from and sharing with people who at least kind of get it can be very powerful experience best wishes
cant do it anymore,if you or someone you know is contemplating suicide please reach out you can find help at national suicide prevention lifeline usa us crisis textline text home united kingdom trans lifeline others
if youre feeling low or suicidal them comment below,feel like some people are not going to comment since some of it cant be shared
wanting to reconnect with old friends,try writing it out to no one first just to get the words down on paper and out of your head doesn mean you have to send it just get it out then maybe send it to one close friend and see how it goes you ve got nothing to loose
may not born to be happy but have hope that wrong,you can be happy if you make yourself happy wish you the best just know im rooting for ya
don know what need feel lost,hey there yes can see this is dificult situation can ask you couple of things do you visit professional do you talk this with your parents and friends you said you are ashamed of what you tried to do last month did you have any of those thoughs again was it because your bf broke with you wish you the best
advice for living alone while dealing with depression,get pet having living creature that absolutely have to take care of is like an anchor
quitting kratom hope to find other ways to cope,was that kratom given to you by professional
just small rant,anxiety and depression usually goes hand in hand its the tag team of death anxiety stresses the brain the fuk out brain goes pop and here we go depression for the next months so if you feel like youre standing on the edge of something catastrophic seek advice and treatment now rather than later that can really help the symptoms not go completely overboard its harder to work on depression and anxiety when youre in the deep end barely keeping your head above water go to your doctor tell him youre feeling unwell tell him how youve been feeling lately tell him this is way outside whats normal for you and take it from there
what to do when emotionally unstable,music is by best friend when get like that and walking you need to release it in healthy way try working out or just jamming really hard to some music and breathe oxygen is your friend
don know how to get back to me,probably not one to be giving advice but just want you to know you arent alone also seem to have just broken whatever switch in your brain makes you happy got desperate and ate bunch of mushrooms while back and that was probably the closest thing ve felt to actual feelings in almost years day to day though im just really good at faking emotions sorry wish could be more help its been shit day here too
this literally isnt even all of my bs theres too much to type,hey there ehote like to do some questions if you dont mind when you say call center you mean customer service or sells if its customer service can give you few advices work with that and love it even the angry clients or the crazy ones are you old or with some stuff that makes covid worse because if you are young you should be relatevely fine in case you have it
finally getting help after dropping out of my classes this semester and almost killing myself again,if you or someone you know is contemplating suicide please reach out you can find help at national suicide prevention lifeline usa us crisis textline text home united kingdom trans lifeline others
