Initial Text,Response Text
don know what wrong with me,hey just want you to know that you dont sound shitty have been there and definitely know people who have too its okay to want better for yourself and to experience proper teenage experience long for that all of the time self sabotage is something also struggle with at least that seems to be what youre explaining think making any progress is good thing and sometimes the brain just happens to eat itself alive and trash all of it but its not because you didnt want it or because you dont deserve it you are so strong for fighting your brain ever single day really hope you will get through this
should feel guilty about working on myself instead of working trying to move out,think working on yourself is always more important than working at job is still young dont feel bad about being at home still you still have so much time to work on other things its good that you work on your fitness this is very good goal to have and you say you have no motivation to pursue anything but sooo many people dont have motivation for fitness dont stress about where others are at in their life everyone has different issues which hold them back in different ways just be careful kind of had the same idea of you oh ll stay at home until ve sorted my issues out but it was kind of way of procrastinating having to deal with real life and found once actually finally moved out it helped me because felt like was achieving something but kind of moved home moved out moved home moved out it takes time to equip yourself for the real world
my life dissolved,if you or someone you know is contemplating suicide please reach out you can find help at national suicide prevention lifeline usa us crisis textline text home united kingdom trans lifeline others
depression is like being in dark maze with no light trying to find the one turn that brings you to the light,you say you feel trapped in huge dark maze but you shouldnt forget about the walls the walls will be your eyes and even if you get lead in circle you can change wall to lead you on the right path its not just wall its foot hold witch will eventually lead you out of the maze
feel as if destined for greatness,ve made bunch of songs and have released one but want to release more also for some clarification diagnosed with adhd generalized anxiety disorder as well as major depressive disorder and we haven yet diagnosed me with bipolar it just been an idea my therapist and have been discussing
wanted friend to call and they didn,if you or someone you know is contemplating suicide please reach out you can find help at national suicide prevention lifeline usa us crisis textline text home united kingdom trans lifeline others
where to go for bpd diagnosis uk,who do go to spring gp is not qualified to diagnose you for bpd you need to go to therapist ideally psychologist or psychiatrist if the therapist only has masters degree in psychology however he she may still be very good at diagnosing personality disorders if he she has many years of experience in doing it suggest starting with psychologist because they typically charge half what psychiatrist charges and are at least as good when diagnosing personality disorders yet because am in the states am unfamiliar with the uk health system your comment indicates that the only way you can be seen by psychologist in the uk is to be referred to one by gp given your situation it sounds like that wont happen for at least more years after you move am sorry to hear that pretty sure have bpd it developed over the past years now currently as noted above if you have full blown bpd it was developed by the time your were years old the strong bpd behaviors however typically do not start showing until the early to mid teens as you likely know bpd is spectrum disorder that we all have to some degree it is pattern of primitive ego defenses we all use they become problem only when our bpd symptoms become so strong and persistent that they undermine our ability to sustain very close ltrs with other adults the human condition is that whenever we experience very intense feelings our judgment flies out the window because those strong feelings color and distort our perception of other peoples intentions and motivations significantly this is true for all adults this is why whenever we are very angry we all try hard to keep our mouths shut and our fingers off the keys until we have chance to cool down we know we cannot trust our own judgment while we are experiencing intense feelings well pwbpd is like this too only these distorted perceptions occur far more frequently because he lacks the emotional skills needed to regulate his own emotions this means that pwbpd experiences very intense feelings and hence the distorted perceptions far more frequently than other people sure that have bpd if you do suffer from full blown bpd you likely experienced trauma in early childhood from inherited genes and or your environment that prevented you from acquiring certain emotional skills most major cities offer excellent treatment programs dbt tfp and cbt that can teach you the emotional skills needed to regulate your own emotions they can teach you how to do self soothing how to regulate your own emotions how to intellectually challenge intense feelings instead of accepting them as facts and how to trust others they also can teach you how to be mindful to remain in the room instead of escaping in daydreams to the past or future how to perceive object constancy to see that your partners personality is essentially unchanged day to day and how to avoid black white thinking by learning to tolerate strong mixed feelings uncertainties ambiguities and the other gray areas of interpersonal relationships absent those skills you must continue to rely heavily on the primitive ego defenses used by young children projection denial temper tantrums dissociation magical thinking and black white thinking my gp said it sounds like have mild case of bpd perhaps he is correct spring bpd is not something like chickenpox that person either has or doesnt have instead it is spectrum disorder which means every adult on the planet occasionally exhibits all bpd traits to some degree usually at low level if the person is healthy at issue then is not whether you exhibit bpd traits of course you do we all do rather at issue is whether you exhibit those traits at strong level are on the upper end of the bpd spectrum how serious the problem is depends not only on how strong our bpd traits are but also on whether they are persistent constitute full lifetime problem temporary bpd flareups most occurrences of strong bpd traits you see in other people are not caused by lifetime bpd instead they are only temporary flareups of the normal bpd traits we all have these flareups usually are caused by drug abuse or even more often by hormone change puberty pregnancy postpartum severe pms or perimenopause or any other life event starting with the letter lol pms can cause strong bpd behavior to occur for several days each month with perimenopause or postpartum the temporary bpd flareup may last several years persistent bpd traits if serious hormone and drug problems can be ruled out the remaining common cause of strong bpd traits is stunted emotional development something occurring before age five that caused emotional development to freeze at the level of young child this is lifetime bpd unless the person undergoes years of training to learn the missing skills spring the vast majority of these full blown pwbpd statistics suggest to of them are high functioning this means that they typically hold jobs and generally get along fine with coworkers clients casual friends and total strangers none of those people is able to trigger the pwbpds fears of abandonment and engulfment there is no close relationship that can be abandoned and no intimacy to trigger the suffocating feeling of engulfment hence with most pwbpd the strong bpd symptoms usually appear only when someone casual friend makes the mistake of drawing very close to the pwbpd this is why it is common for high functioning pwbpd to excel in very difficult jobs such as being social worker teacher surgeon attorney or salesman and this is why most pwbpd can be considerate and friendly all day long to complete strangers but will go home at night to express anger against the very people who love them
my sister just told me that she is feeling and hearing some being once week what should do please help me out,oh picked up few of these over the years understand your conscious mind is you as person and is what keeps you and your body up and about you have no control over you unconscious mind however and this is what connects us all together heaven is in fact our collective unconscious minds and ghost is just one of these tagging along with you here when it should be over there if you do not know what you are doing they can hurt you take over your body and do bunch of other bad stuff unless they are friendly and then they just sorta hang out and dont cause issues and can even let you know something is up tell her to close her eyes and envision opening ring or portal of light over her head expand it out to cover the whole room and guide the spirit into the light so it can go back where it belongs usually they want to go anyways but they will let go of you fuck off if they dont want to go back for what ever reason as they will get pulled through by force if they stay to close to it for too long its one way path from here to there if she cant manage that she may need to get someone who knows that sort of stuff hands down to do it for her and guide that soul back to the whole where it belongs all said and done it is sad and in pain as down here it is only fragment of what it was and well how would you like to be missing arms and legs granted for them its more like missing pieces of once mind and memory which is what can make them unstable and dangerous
my girlfriend is having problem with her consciousness and don know how to help,she should eat meat it ll help her mental health the vegan diet is malnutrition diet and will most certainly cause mental problems due to lack of proper nutrition
how to get help when you cant,church actually isn that bad even if don believe give it shot when those thoughts come in just talk to god always helped me
there lot that has happened in my life but some days feel like lack emotion,care you don sound like an idiot at all your feelings are important and hope you heal from all this
sos to anyone out there,if you or someone you know is contemplating suicide please reach out you can find help at national suicide prevention lifeline usa us crisis textline text home united kingdom trans lifeline others
what is wrong with me,honestly this could be many things but wont list them cos its not helpful dont know what the mental health services are like where you live but pls reach out to them outside that pls talk to your fam if feel its safe to do this isnt good for especially at such crucial point in your life you dont need diagnosis not from me nor from your fam or yoursslf you need support get nightlight talk to your fam about your anxiety and also ur school of there avenues for that not all schools are helpful so if you think it will do more harm than good leave it main point you need support at home professional help takes time depending on where you live were taking years so make sure the people around you know how to help would suggest checking out mind org and the hearing voices network which sure have local sites worldwide theyre mainly for auditory hallucinations but they can help with visual anomaly as well suffer auditory hallucinations and severe anxiety etc as well so if you want to ask anything in depth pm me
has anyone ever gone through something like this feeling weird,maybe this story will help clarify what talking about so when first started meditating started because wanted to get rich yes no joke my motivation for meditating was because thought it would give me an edge when it came to being entrepreneurial doing well in school increasing focus ect so could make more money basically the weird part is when started when was convincing my self to keep meditating when it was giving me no results would tell myself that it was working that was elevating my consciousness that was becoming enlightened and it now feels like it actually is happening thats the part that makes me so uneasy its bittersweet literally feel like in the matrix simulation or like how jim carrey mustve felt in the truman show when he realized what was really going on
feeling overwhelmed,take this from someone whos currently going through the toughest time of his life gf of years is ending things you are good enough fuck those feelings that you arent you were good enough to land this hottie in the first place shes stayed with you long enough for this not to be quick fling its not going to be easy but youre going to have to retrain your brain to think differently dont be so harsh on yourself everyone makes mistakes but choose to learn and grow from them cant pretend to understand whats going on with you or how serious it is but seek help be open with your gf or friends or whoever bottling up your feelings gets you nowhere but where am now and wouldnt wish this on single person be the better person wish had of been the person trying to be even though its too late for me its not too late for you you have to believe in yourself and trust me if its meant to be those arguments will fade believe in you believe in yourself
no one really looks at my stuff but just gonna leave this here,know the feeling so so tired of caring of trying most days dont know why do it but keep waking up stay with us man covid will end and maybe we can do something after this
feel like drowning and don know what to do,do you mind me asking what happened with your first therapy experience it is not uncommon for your first therapist to not be good fit what about better help or talk space those therapy things where you can just message therapist rather than actually go see one sorry know this isnt the kind of answer you are looking for but my first therapist was terrible and thought never go back but my second was so helpful and idk what id have done without him but if you could give more about your experience with the first one but also please dont feel like burden and you are not alone whatever you are going through you can get through it its hard to make any suggestions not knowing more about your current situation or your past but read book called the body keeps the score by bessel van der kolk it talks lot about ptsd and trauma but think it helped me lot understanding my depression and anxiety as well which for me helped lot in making me feel not so crazy made me realize my feelings were valid and not my fault and idk it just really helped in understanding the brain especially after trauma again its hard for me to know if this will help you or not without more information but hope you can find way through this
am dissociating,been struggling with this for months you ll learn to live with it think positive engage in conversation and if it happens put block of ice or ice cubes on ur neck for seconds minute this will shock ur senses back in place doesn work unless ur thinking positive
so exhausted and have no clue whats wrong with me,go see doctor as it could be lots of things you don mention other symptoms other than your ocd if you are diagnosed with ocd you may need adjustment to your treatment
please help cant stop criyng,let it out crying until you cant cry anymore can be cathartic then evaluate after what may be causing it and take steps from there hope you feel better
feel really bad for snapping at my mum,think at some stage every kid snaps at their parents myself my brother cousins and even some friends have had massive arguements with their parents and sworn at them give it time and everything will heal
she acts like she hates me,suggest you read on misandry misanthropy and bisexuality this post kind of explain were am going with this take note that it does not necessarily applies to your so but keep in mind it is really common problem happened to me
does anyone else feel like it took them long time to find the right chemicals for their brain,yeah at first the meds didnt work we switched pills for year so stopped taking them at all but took the prescrip to make my psych thi nk was decided to try again ish years later and now im the best think it will be feels good but like said its shame didnt come around sooner
get this weird bursts of uncomfortableness,your loved and ur not crazy here to talk in my dms whenever you need it
first therapy after attempting suicide,if you or someone you know is contemplating suicide please reach out you can find help at national suicide prevention lifeline usa us crisis textline text home united kingdom trans lifeline others
feel like everyone know strangers too hate my guts and repulsed by me,let me help you out fills your pockets with fuck now remember never give one they can buy them with meaningful interaction but never ever give one
letting myself be used,wouldnt judge yourself too hard for letting him back in your life if it makes things feel little better thats ok but know that maybe no one will be exactly like him but there are people out there that can meet your needs in different ways that may feel even nicer that you dont realize you want take care of yourself try to take care of yourself emotionally the way you want to be taken care of eg if wish someone would go on walk with me go with myself if wish someone would cook for me cook for myself try to be present with myself when dont have the energy say its ok sometimes the easy thing is the best thing but know the joy of the past is absolutely available in the future with someone new could even surprise you life is rollercoaster its unpredictable but it can lift you up just as quick as it drops you down
broke down at work next steps,don have answers but can tell you you are not alone as this happened to me also stay strong
where do even go from here,if you or someone you know is contemplating suicide please reach out you can find help at national suicide prevention lifeline usa us crisis textline text home united kingdom trans lifeline others
how much does childhood trauma affect present me how do get better,once had therapist who just let me go to therapy and talk about my trauma for an hour but it didnt actually help make any improvement in my life find it is best to talk about trauma in context when it arises but to otherwise not go to therapy with the sole intent of talking about it for example if something happens in the present that reminds you of the trauma or if you are having flashbacks then it helps to talk about the trauma so as to process it however have found that excessive introspection and the constant inward looking to figure out why am the way am quickly got unhealthy and damaging eventually causing more distress than relief childhood trauma can feel really pervasive throughout your life everything can seem dysfunctional and linked to it but my advice is not to dwell on this but to focus on hobbies friendship your present life and address any issues as primarily current problem because even though you might know the issues stems from childhood the way to heal is to meet those needs in the present like to see it this way whats still causing the distress is that the present self currently has access to the past but your childhood self does not have access to the present this is whats keeping the both of you in traumatised state because its one way road that only goes backwards to the traumatic past replaying repeating and intruding on the present however its not continuously going back to the past and analysing it that will heal you but its you bringing your childhood self into the present by giving yourself what you needed back then in the here and now that will heal core aspect of childhood trauma is that the child feels like they cannot escape the traumatic environment and so in healing it is our job to let that traumatised child part of ourselves know that actually it was not an inescapable situation and we can escape it and we can also go on to find happiness and safety absolutely acknowledge the trauma and understand how it effects the present but with the intent of using it to meet unmet needs in the now
feel helpless and loathe myself,if you or someone you know is contemplating suicide please reach out you can find help at national suicide prevention lifeline usa us crisis textline text home united kingdom trans lifeline others
should message my old friend,wait for her to message you depending on the severity of the situation wait longer if things are really bad check in after like year if she doesnt even want to hear from you then its sadly dead end some people are like that
dont want to die but rather die than feel this way forever ya know sorry this is bit long,okay they may try to delete it so am putting it here reddit post
can do anything to bring light to my abusive friends,dude overall bad friends aren really friends toxic relationships are detrimental you put in time and effort and energy into it especially emotionally etc we are close is not really good excuse but sometimes it depends on your measure of the relationships outweighing the good with the bad not everyone is perfect and sometimes people will hurt you whether they know the impact it has on you or not
vent if anyone reads it sorry,they broke up while ag but it still hurts
anyone else experience overwhelming withdrawal,if wasnt assuming you were american reccomend trying to reason with your pharmacy in the meanwhile
am disgusting,hi can really relate to your experience dont know exactly how to help but understand what you re saying
ve been using lamictal and seroquel for little over weeks to treat my depression and anxiety and,lamictal also changed my life completely after trying other drugs swear this one is miracle pill from my experience though the dreams stayed vivid and real if you want to silence them smoke weed before bed
just dont want to well do anything if you dont want the backstory ii describe my problems about halfway trough the post,well im not good at stuff but against stress im gonna try so im assuming you dont have time to go to the pool or gym look bad social life can reduced your life span immunity so do you have time to go out and run do squats planks and stuff if yes make calendar for sport running and other sport makes your body throw away heat from your body while making it so it kills the bacteria and viruses on your skin and can reduce stress over time if you have back pain or other problems then talk to the doctor and if you can afford it get therapy and meditation and get social partner friend this is copy pasted message made and im using it have few but lost them used to spend hours helping ppl like you but guess got lazy so copy pasted
how to get rid of fear,just go for it man you cant succeed if you dont give it try dont be afraid to fail because thats life learn through failures and use them as lessons you are still young and the life is in front of you dont be afraid to live and to get hurt you may get hurt in the process of trying but thats how you learn its impossible not to make mistakes hope you are doing well take care of yourself man
what was it like being arrested for calling the hotline,even as someone with largely negative emotions towards inpatient mental health care can safely say its not as bad as youre thinking imagine less insane asylum and more like hospital with less medical gear blue scratchy blankets inoffensive tv shows showers that never get hot enough the general purpose is to be as mediocre as possible so it gives people break from real world stress but also isnt too nice cause yknow budget cuts not the rest of your life probably less than week drug eh maybe some people dont like psychiatric meds and get that it also depends on what youre there for and what youve already tried beat no not much else to say but that once again not downplaying anyones negative experiences with inpatient care our system is in desperate need of reform but it can have its place and its benefits and its nowhere near how youre describing
absolutely need therapy but feel it might be unsafe for me,when we are not our tru selves it is like streaming against the stream we get exhausted and maybe drown when we are not who we were truly meant to be we rob the world of the gifts our true self possesses if people dont like it that is reflection of them not you
anyone else suffer from depression and anxiety as well as autism any coping mechanisms,music helps me ve got all of the things you listed by the way it kind of depends on your symptoms one other thing recommend is name your mental illness and then write rants yelling at it cursing it out threatening it and the like another thing is doing something creative
its not fucking personality disorder its the way you are period,fun fact learned while studying for the mcat personality disorders are slowly not being considered disorders
need help understanding why my vision changes,you might have diabetes one of my best friends found out after like back to back car accidents just came out of nowhere for her and she tiny like so it not like you think she was at risk at all
