Initial Text,Response Text
im not happy,can relate but instead of drinking spend hours playing online games to forget how miserable my life is its also annoying seeing how most my friends have it easy in life maybe its jealousy or maybe tired of doing my best and not being rewarded for it either way try to see it like this yeah life is hard and mostly shit but imagine living the rest of your life tacking the challenges you face every day and grow to be an old person thats alot of perseverance grit tenacity and experience youve just gained that you can use to help others someday and you badass for making it so far
my dog saved my life tw suicide,so glad you re still here pets are family and they absolutely will be there for you at all times again so glad you re here
yesterday became years clean from self harm so proud,congratulations many many best wishes may you radiant power to your near and dear ones thank you for sharing this is very inspiring best
right to die,if you dont want to live its probably due to chemical unbalance in your brain in other words disease you cure ill people you dont kill them unless theres really not much left to do and in this case is not the ill person the one in charge of the decision if you are depressed then you should have treatment not death
to all the people struggling mentally,agree have had it rough for most of decades now people saying oh was soooo hard for me agree that it has been rough for them but also can not shake the feeling of you dont know what rough is sweetheart try living with my demon for hours and you will see what rough is have lived with it for long long time now yeah know it isnt healthy to think that way and try to be empathetic but this pisses me off privately
my mom died this morning,hey buddy that really unfortunate take care of yourself remember you were still apart of her life and now you can mourn her and go on with yours take care bud
dear men of mentalhealth,great post thank you for the kind words as someone with depression cry fair bit but still to this day try and hide it as much as possible was just brought up with that guys dont cry attitude and its hard to break that even in my
have three personalities and dont know which one is actually real,had almost the exact same thing had chill nice to be around social personality had toxic and angry personality where would make fun of people especially when playing xbox and would hit myself out of anger and bite myself really hard and such and then theres the almost always silent depressed always thinking about the past and feeling sorry for myself personality dont know how to help at all wish could and not sure what happened with myself but now sort of just disassociated from reality constantly dont cry anymore dont genuinely laugh much anymore although surprisingly eric andre makes me laugh bit but yeah im sort of just shell of person now dont think this is the way to be but maybe my mistake was not being able to go to therapy and such because of what believe to be adhd wish you the best definitely dont think its just you that feels like this though but would recommend talking to more people about it if you can and hopefully other people can comment on this post with their experiences and what they think might be for the best
daily reminder to take your meds,both and it lithium lamotrigine for bipolar disorder
hearing voices but they tell me not to tell my family,personally believe that you should tell your parents and or go to the doctor personally don hear voices but ignoring the fact doesn make it go away if the voices do get angry at you then know that random person believe that you did the right thing lot of things that voices say are irrational and create fear know it hard not to believe them but trust in you to fight through it
uncle is secretly sniffing my bed,if anything think you under reacted that behavior is very unsettling and concerning and inappropriate and something needs to be done be sure to secure your delicates so those dont go missing this is not ok and you should fix it if you need you can get outside help to help you resolve this and possibly sleep better
what song do you listen to when life gets overwhelming and your mental health gets tough,listen to the station on pandora radio it helps distract me from the urges experience and it helps me sleep
question for people who ve been to psych wards mental hospitals etc,hows your health insurance hear state hospital wards can be pretty bad was admitted to sort of free standing private inpatient behavioral health hospital for about week actually really enjoyed the whole structure and help received like knowing can go back there if things get too bad again
youre too sensitive am told,completely agree your emotions are valid and its completely understandable why you feel this way when someone invalidates your emotions it can make us feel guilty for having and expressing them which can make things worse hate it when people say that to me too
read on if you want to see my problems,you ve taken great step you found place to open up about your feelings and did so it can take courage to do that and glad you were able to
have ptsd and keep feeling the urge to see more traumatic things,theres some tips in this post which might help how to overcome ptsd
moving to tn to start better life for me and my children supportive words only please,you re in rough part of your journey so glad you re getting out of the exploitive relationship with dad sounds like you have an amazing sis best of luck as you get settled and duplicate your resource network of support you seem to be holding up pretty well
mental health decline at home,set aside minutes to clean up etc put some music on maybe learn to enjoy keeping your space clean up know its easier said than done when you feel like crap but try and get back into that positive habit it will make you feel better definitely thats what worked for me
school ruined my life tw sexual assault how can fix this and get help,am sorry you had to deal with this believe the school was trying to help you by telling your parents have year old daughter and when she was she started having suicidal thoughts the school informed me and made it foal to better our relationship and get help for her it seems your parents broke their oath as parents to you being sexually assault was never your fault and your parents shouldnt be ashamed of it and push you away that is unfair to you and the school system most likely thought they were caring supportive parents like they should be youre and homeless wtf is that sorry but your parents should not allow that and help you out was aised by very negligent parents and was in foster care at so know what it is like to feel like you have no one that isnt right have to tried counseling with your parents they need lot of work even parenting course dont feel guilty or ashamed it is not your fault you have been dealt with shitty parent card and they should of done more for you am very proactive with what foes on with my daughter because she suffers from depression and has adhd accept her for who she is gave birth to her it is who brought her here and need to protect her wish your parents did the same for you
feel trapped with no way out at all,hey lad keep it steady vet here here are some tips for dealing with your problems my man talk to your ncos or chaplain religious personal but they should be able to cater to you even if you are non religious dont take the jokes to personally thats kind of part of military life for example originally from scotland and still have bit of my accent and my last name is bean private message me mate know first hand what it is like also if you can get recorded documentation of them refusing to help you that should be brought up your chain of command we took mental health very seriously in the military in the states now lastly here is an exercise for you to try step sit down with your hands on your lap and your feet flat close your eyes and name emotions you feel step plant your feet open your eyes and say things you can see step repeat and but now use things you can touch then smell then hear and finally taste this is thought grounding exercise and it has helped me throughout this past year
just wanted to share that sad,try doing this exercise my therapist gave me step sit down with your hands on your lap and your feet flat close your eyes and name emotions you feel step plant your feet open your eyes and say things you can see step repeat and but now use things you can touch then smell then hear and finally taste this is thought grounding exercise and it has helped me throughout this past year
for awhile ve been having my thoughts of hurting other people,get help ve had similar parts of my life and it may be due to your childhood etc therapy or psychiatrists be good step just keep trying the fact you are worried shows that really theres good person there just someone whos probably been through lot stay positive
ve recently switched doctors after seeing the same one for years and my new one immediately referred me to behavioral health professional,if you are correct and they have broken hippa laws you should choose different therapist and relay those concerns to them do not share that concern with the two involved individuals because they could be bias and they would have reason to lie you need neutral person who can help you dissect those concerns and explore if they are valid and if so what you should do about them if you need the referral to get psych help because of insurance issues you can make gp appointment explain that your doc referred you to psych that they know personally and you suspect they discuss your personal medical details with and say youd like referral to someone neutral and trustworthy if youre in small town you can use telehealth options to find gp and also telepsych options
my lack of self control is ruining my life,am around the same age and have such similar problem its like can tell myself what can do and can do it correctly when am motivated for few days in row but as soon as something happens or even just after small time the first inconvenience really and then am back to the laying in bed all day playing those same phone games and eating cause bored always tell myself that if had someone to push me even just little bit that would be able to make it all happen have no idea if that is even true just believe it and have never had anyone who even tried even after asked them wish the best for you and hell if you have any recommendations that help would love if you shared them and heck if you need someone to talk to feel free to reach out honestly am glad to know am not the only one who feels like this
maybe were not the incorrect ones,at what level of population saturation of mental illness does the current attitude switch to hey maybe those mentally ill people are onto something dont understand this statement what exactly are mentally people onto that the general population is not same as your title what exactly do you mean maybe were not the incorrect ones
should mental health professionals advice client to lose weight get fit,psychologist and advising exercise and good nutrition is something that we do as far as specifically concentrating on weight would be hesitant unless client brought it up even then have focused more on intuitive eating in the past eating more nutritious foods exercising etc as opposed to using any kind of numerical measure for weight for one thing we know that bmi isn always an accurate indicator and two focusing on number can sometimes induce disordered eating don think there anything wrong with encouraging healthy habits but wouldn tell client to lose weight
need someone to help me out with this,dont know what could be causing it but recommend music quiet so it needs to be focused on or focusing really hard on writing story in your head those both give me distractions from my head
self care is not participating when you don want to,but also sometimes it about participating when you don want to sometimes our irrational and dysfunctional thinking can lead us to become socially withdrawn or inhibited and that can worsen our emotional state sometimes it also about pushing yourself to be with people you get along with and who care about you
am being dramatic or do need to admit myself somewhere,if you or someone you know is contemplating suicide please reach out you can find help at national suicide prevention lifeline usa us crisis textline text home united kingdom trans lifeline others
how do check up someone,usually people ask how im doing or just ask if want to call or chat for bit and remind them ur there and let them know if they want to talk it doesnt have to be about there feelings
who else feels like this,know this is going to sound so capt obvious and stupid but have you tried calming yourself deep breathing visualizing calm scenes in your head etc to see if that helps sometimes when am on the edge as in want to set something big on fire which swore to myself and society that would never ever do try listening to music or getting involved in doing something physical like cleaning or even hitting rocks with other rocks it sounds juvenile but it helps good luck to you
went into state of psychosis for short period of time months ago and all my friends once had still won acknowledge me,im alone by choice get crazy and unhinged around people feel free to rant to me anytime im pretty depressed die inside tonight myself
ive ordered one christmas present have no money and the guilt is choking me tw ed,you can not eat for month your friends and family will understand
need some advice,think there is merit in seeing therapist at any point in your life for any reason if you find your thoughts never settle and its impacting your life then ya definitely talk to therapist or doctor they should be able to identify whats going on and give you strategies for effectively calming your mind does anyone in your family have an anxiety disorder or adhd
how to just leave behind all the bad memories and just move on with your life,struggle with this as well what sort of helps me is living in the present moment focusing my attention to the right now do my best to not think about things that happened in the past or what may or may not happen in the future
update terrified of politically motivated violence,so sorry that people dont believe you that has to be all the more awful think the best thing to do is as suggested stay inside avoid people you dont trust when you can which is good advice during pandemic anyway by doing things like ordering your groceries by delivery and socializing digitally and if someone starts to get aggressive with you dont think there is any shame in letting them know that you are autistic and telling them that you cant process their questions properly because of it regardless of whether or not its true telling lie to keep yourself safe is perfectly acceptable also if you are able to move to an area where you feel safer that is reasonable option if you have to shelter in place try to add things to your entryway that would make you seem like an unassuming or unideal political target like sign that asks people not to smoke because oxygen is in use on the property which can suggest you are ill or living with someone elderly mind you these can also make you robbery target so youll have to balance the risks on both ends youre allowed to trust your instincts and youre allowed to use your best judgement to better your life there are people who dont want your experience to exist publicly because it does not suit their narrative but they need to deal with the fact that not everyone lives an experience that reflects the average experience think its good that you are not dissociating from yourself from your own life to appease strangers
hi everyone need some quick advice,draw heart and write positive things about myself and just imagine that voice as being bully like kid in school that picked on me and just not ignore it but dont believe it if its saying ur manipulative theres chance its because it thinks that ur nice person my heart usually also has things love and lists of my favourite things about me and things care for
should start self harming,started self harm at thinking like you did though was and am binge eater and get sick from it am addicted to self harm to point where every time feel really bad cut now have deep scars on my leg even though when started said only do it gently its lot harder to restrict your cutting in the moment you feel bad than eating restrictions also if you want to chat about stuff and vent dm me im happy to listen
every day seems to blend together is it more worth it to not sleep,usually if you xo this it slows you down so in the longer hours get the same amount done and feel way worse ve seen muself doing this and it doesnt make feel like you do more really its better to keep up the healthy habit of sleeping
postpartum tw suicidal thoughts self harm,hey at weeks the medicine may just about be starting to settle but not all the way there its good idea to see your doctor again and see if they want to change anything and tell them all the issues you have described in this post and remember no matter what you leave them they would both be such happier if you told your partner your struggling like you are and got help know some friends who lost people to suicide and it broke them theyd much rather of had chance to help the person they love and make sure they are okay also maybe seek counceling therapy psychiatrist help it will help and if you think youve decided to do it you may aswell try these first what harms it going to do to try fix things first its worth giving it all good go first am here if you want to dm havent been in your situation but ve struggled with suicidal thoughts and self harm and here for you if you need
feel like an animal caught in cage,hey may not relate to this but feel free to message me and continue venting hope can help and here for you stay strong really believe in you
first appointment with psychiatrist,dont cancel and you wont be if anything the fact you think ur making it up like this is almost proof you are struggling go to he appointment nothing bad will happen and they usually ask the questions they have id take notes of things you struggle with though so you can tell them incase something is missed hope it all goes well
need advice,maybe its still worth seeing councelor or therapist as it may help you figure out why you feel this way also its worth remembering depression can show different in different people it may be worth even just showing her this post or texting her something like it if you are feeling comfortable and explaining you care about her and want to be able to partake just arent ready right now dm me if you want and good luck
am delusional,it sounds like you are connecting things that arent connected lot in this and maybe its just individual things but bacuse your ere caught up on the night its just changed you from looking at this as random to making them into conspiracy in your head dont know how to explain more my other thought was did you take anything that night or is there chance you were spiked it may be reason your behaviour and thoughts changed afterwards
have question for americans,that exactly how you do it as for the cost it depends on your insurance
how to get over imposter syndrome,kind of have this with course am doing just try remember to get the grades get have to be at that level and need to stop over analysing also most people start job and have to continue looking stuff up as they work its not rare and its hard to memorise everything instantly also remember its the mental health issues speaking and they arent going to tell the truth to you anyway
think was given wrong diagnosis and am afraid my clinic won believe me,whatever you do dont go off lamictal without talking to doc first you have to ween off it
idk where this is going just gonna type the shit gotta get off my chest,sending you lot of love hope you get to feel all the feelings you feel and get the support you need don have any advice but feel you it hard to not be able to speak to anyone properly about what you go through thank you for sharing
am taking myself off medicine because it made me hallucinate,it deffinstely isnt something you should feel bad about or incapable for having anti depressants affect your brain sometimes for better and other times for worse am intelligent but when on anti depressants it affected my ability to get days names times and words right symptoms can take long time to fade from anti depressants also all my life ve heard some form of voices and as long as you are level headed and can realise you are making these things up you are not unfit also you are experiencing medical issue shouldnt feel embarrassed its like braking ur arm same sorta thing
those who struggle with depression do you like taking pictures of yourself,not at all the only picture have of myself is from last year and it me and my mother hate myself in the picture refuse to take pictures of myself am even uncomfortable looking at myself in the mirror
idk what doing anymore,you arent exaggerating or being spoiled you havent had good childhood and that messes with people my advise is to just do what you enjoy and look for jobs you cant control or plan further than that right now all ve realised from hanging out with older people is that no one really knows how to be an adult if that makes sense also if you want you can dm and rant to me or call and chat about things also getting job means usually are around group of people and form friends there as well as your irl friends
stigma around mental disorders,agree when was in the mental ward we had guy named kyle nerdy kyle not punch hole in drywall kyle who had schizophrenia and he was such gentle and kind person mean he had his moments but he never endangered others more likely would climb on things and endangered himself but our conversations when he was taking his medication not talking about being sedated but taking his daily medication he was one of the most intelligent people had met and sat and talked with me about my ptsd and autism such good person and hope he is doing well
dont know what is happening to me,suggest you talk to therapist rather than asking strangers on reddit the sooner professional looks at you the easier it will be to recover theres no shame in seeking professional help there doesnt have to be something wrong with you to do it people seek therapy even for the smallest things like work related stress or having trouble getting up in the morning trust me you dont want to neglect any mental issues you suspect you might have the longer an unresolved problem exists in your head the worse it gets over time and it might take over your personality completely if this has started happening fairly recently it will be very easy for psychiatrist to help you the longer you postpone check up the worse it might get dont risk waiting for it to pass dont make the same mistake and many others did take care
advice for dealing with annoying songs stuck in head,apparently singing or listening large part of the ending can subconsciously provide closure but not sure how much merit there is to it few sources such as psychologytoday who stray steps finally get song out your head amp endorse it though so give it try
novel mindfulness methods study for treating self injury living in canada,oh look yet another mental health subreddit with rules against academic surveys studies and you dont seem to care
literally everything feels like shit and don wanna do anything can like even think one fucking thing that wouldn make me feel like shit,good thinking booze only drowns those sorrows for small time and you usually end up feeling worse afterwards because your problem is still there and now you have hangover on top of that not fun take it from me am an alcoholic and know it used to drink every day because it had started with me just trying my hardest to forget the family issues had been having at the time and trying to forget that am just screw up who had wanted to kill myself to rid the world of my stupid ness know not proper word lol unfortunately what had happened is that would drink get wasted and then the next day would feel so bad physically and mentally that would have to drink more to get rid of that feeling which led to me feeling even worse which had in turn made me drink more to get rid of that pain etc that is how had become an alcoholic at years old am now and had just stopped drinking cold turkey years and almost months ago feel fantastic now even though the problems still pop up from time to time at least can deal with them without needing to get wasted instead face them head on and just deal with them good luck to you
need advice regarding ssi missing persons,is your mom still rep payee since you are you can be your own payee but dont know about the living situation youre in have no clue how that would affect it call your local ss office and inquire about becoming your own payee you might have to set up bank account that is set aside only for that purpose we have bank account for each of our boys all who get ssi well the yr old will continue to get it as soon as they finish determining that he is still disabled which he is and give them the routing number of that bank and the acct number again if you dont have permanent residence dont know how you would work that stuff out hope you can figure it out though getting ssi for yourself will help you esp since there are lots of social programs in most cities to help people who are lower income or on fixed income like ssdi ssi hope your city has something to help you good luck
