Initial Text,Response Text
feel so uninteresting and hate people who are so knowledgeable in many topics,people arent an infinite void of knowledge and wisdom everyone knows something that you do not and you know lot of things that someone else doesnt know think you feel as if the things youre knowledgeable about are boring in reality some people might be fascinated in you may know more than some people about life careers management etc you know things that other people do not ve met tons of people who are confident about what theyre telling me only to find out eventually they were spewing nonsense some people lie to make themselves look better you have the self confidence to not need to do that you need to remember that you are not useless dying would leave hole in the fabric of time you have value and you are loved
quarantine is making me feel super sad and dont have any friends to talk to,with you my friend with two children and ve felt like this most of my adult life never got on well with other girls and didnt form really close friendships with them after left education have group of mum friends who socialise with for my kids sakes but none of them are really the confide in or go on night out with kind of friends very lucky that close to my sister whos only years my junior but other than that pretty much just have what youd call acquaintances quarantine lockdown has made it so much harder for people like us think and the isolation is felt ten fold really dont have any advice for you but just wanted to let you know youre not alone and if you ever need sympathetic strangers ear my inbox is always open
few years ago was in very bad place and wrote poem wanted to share it with you guys you can struggle and still pull through believe in you nsfw,this is so moving so glad you shared this it postings like this that also motive me to write more
how to get over the grief that there are so many people ll never get to meet or be friends with,had to get kind of spiritual about it these people might be really cool but the chances of you meeting the awesome people you already know are so small like to redirect that energy into appreciating them and letting them know appreciate them in terms of the spiritual bit kind of adopted the idea of im going to meet and become close to the people meant to and not meant to be acquainted with everyone that like to be
our most broken and least understood rules is helpers may not invite private contact as first resort so weve made new wiki to explain it,understood and apologise if forget in the future and break it
regular check in post plus reminder about the no activism rule,one of the hardest things for me has been realizing that when people say you can talk to me here for you they generally don mean it friend thought was close to gave me that spiel and when opened up to her about how was feeling she immediately recoiled and said you need to talk to professional not your therapist she said it as if had talked to her against her will when she was the one who repeatedly invited me to open up and declined at first because didn want to bother her know she not my therapist know that no one owes me anything wasn looking for her or anyone else to fix my problems or even offer advice all wanted was for someone to listen to me and maybe try to empathize it would ve meant the world to me just to express my feelings to someone and hear them say that sounds hard sorry you re dealing with that instead of lecturing me thought she was willing to listen in the same way that listened to her in the past don know what keep doing wrong think the best option is never to open up to anyone
stop telling skinny people they look skinny,this becomes more common as more and more americans get fatter normally built compared to americans thin funny in way
flip between apps hoping for some bit of communication,understand how you feel hermit myself essentially initially liked it but now realize human interaction is necessary element but needless to say its not something great at
missed the train its cold and sitting here in tears idk,did you find way to get home safe pm you must be on the other side of the pond hope that you are able to find way home it sucks that things that feel passionate early on turn super competitive and high pressure as we get older think thats awesome that you have music that brings you some calm and peace do you think you can spend some time playing the instrument you like as source of stress relief no one has to really know about it just for you
literally have no motivation to do anything,your loneliness your depression and even your cup it will all rob you of your life if you dont escape now youre not just lazy youre depressed but theres still lot to live for especially at your age was in similar situation except didnt escape and now its been five years ruined my life prioritize your health enjoy the small things take each day as it comes you can do it and you will never get another chance at this thing the time you are burning through is non renewable resource nbsp this anonymous stranger believes in you
my parents when wake up late this isnt normal please wake up earlier,and recently had to move back in with my parents due to covid and pending divorce they still pull this shit
so tired from even trying to start my day,the thought of making coffee is what gets me out of bed every day
don deserve this shit,did nothing wrong life is rigged you either win or you loose its all about luck and genetics if your born without luck and with bad genetics your fucked
unique coping mechanism discovered,thats actually seems useful as coping mechanism thanks for the share bro tried many types of coping mechanism that may help me but still havent found the one that will actually help me again though thanks buddy have good one
being an adult feels scary,don think this feeling ever really leaves you or at least it hasn me and not far off but did find that it fades over time had to focus my energy into one part of myself or my life until felt happy with it and then branch out one area at time until got happier and more comfortable in my own skin don believe this is one size fits all solution but had success with it over time and maybe you would too but it starts with you looking at yourself and asking what do really care about
wish died when was,those counselors are not doing their due diligence depression normally only gets worse with time if not acted upon if you had the perfect job do you think things would feel better for you across the board or do you think it goes deeper than that to something like cyclical dark thinking identity troubles not knowing who you are etc past trauma or something else
is calling the suicide hotline safe,have never called one but as far as know the samaritans have policy of not calling the police
theres no winning if youre not happy youre unwanted,it really is such bummer hate it keep quiet to myself and act like things are fine but sometimes the rage builds up and ppl can see it on my face idk what to say anymore
told my mom suicidal and she told me will burn in hell,you won burn in hell don believe in god heaven and hell etc but if it real no father would punish there child for being in manic episode sorry to her your mother said this it not right if you not already see doctor or therapist asap
all it would take is one,understand that feeling have never really had close personal connection with anyone in real life have online friends partner that lives halfway across the country and family within few hours but have never had that one person in my real life that can just lean on when need help hug when feel like need to and just have there as friend so can do the same for them suppose it doesnt help that havent really made an effort to find that person but always keep my eyes open and think you should too you never know they may be right around the next corner
just need someone to talk to,someone who understands here for you
am worthless,hey youre not the only one feeling this way im not trying to be condescending but have my own fucked up demons that currently facing this year hasnt been easy on lot of us out there its okay seek some therapy if you can just know youre not alone in this peace
dont deserve shit,its weird because believe in my somewhat irrational brain that everyone besides me deserves love and compassion and happiness because contribute nothing so hear you on that one its not at all enjoyable to have this weigh on you all the time wont waste your time by telling you that youre lovable and worthy etc because youve clearly heard it all before just wish we could figure out way to get through this
do you ever get tired of not being happy,to be honest can relate to lot of things you just said the people and their cowardly behaviour how annoying they are and how much actually people care about you the bad is that am tired of not being happy but if start somewhere to go to the point where get better or happy kinda think of all these sad things actually and some bad seed in me reminds me that theres nothing to be happy about and then feel like have to be sad and depressed dont know why although hold on we should all be grateful that we get to die one day sorry not very optimistic take but please hold on and take care
life doesnt feel worth living when nothing makes you happy,the worst part is watching everyone around you be happy seemingly effortlessly and you cant be happy no matter how hard you try
dont promise mentally ill person that youll never leave them,im mentally ill but completely understand these people even if it hurts we re tiring to be around
hate fucking everything about myself,useless no skills no accomplishments how long was the longest time you tried to get good at something true skill can take years to foment stupid is this due to mind fog where you cant concentrate or remember or more problem of understanding material due to holes in basic knowledge stutter shy anxiety suspect this is likely due to cognitive pain from the depression making you overthink fear judgement fear exposure of how you feel about yourself or something similar to that have you had any good success finding the origin point of where the depression is coming from bud it can be obvious in some instances but there are many people myself included who had roots that were completely hidden until after tons of introspection and research
hate myself so much,bullies crowdgang and attack that way because theyre cowards you didnt believe what they said about you did you
am bad friend,yeh cussed mi ex girlfriend out couple of times and can barely look in the mirror after that fuckin sucks how it alternates between angry and sad depression
don have anyone to talk to tw suicide,maybe it possible that it time for you to switch therapists if you don feel comfortable speaking to the current one about how things truly are going for you
the older get,thats normal unfortunately feel the same way especially after moving out of the familys house it puts lot of things in perspective and have realized over the past year or two that cherishing the little things is really important thing have realized that however insignificant we are in the grand scheme of things we can be significant to the ones around us hell sometimes just writing comment to someone on here can make you seem significant to them you know find things you can do to give yourself significance thats all we can do best of luck friend
tips on pretending to be okay,have some tips smile good way to hide is to fake smile be friendly and seem happy do this when with friends and family for me just dont talk about my issues with other people thats all but please get help if you dont feel the best
nothing interests me anymore,same don have any advice sorry but feel you my finals are near too but my head is empty
whenever laugh my head is telling that shouldn,it might be an emotional habit do you spend an unfortunate amount of time day by day agreeing with and empowering thoughts of self hatred or hopelessness in time the sheer momentum can cause them to continue on and affect you like this without reason
got called loner by my colleague today,loner can be compliment but your colleague is an ass nonetheless
im in loveeee,don think he would have put in the effort just to play with you not sure how old you are but people come and go and though there isn the one it usually takes minute to find solid match toss the whole undeserving of love mentality if you haven committed any terrible crimes you deserve love and you ll find it not to sound like self help guru but know you re bad ass and know that you re not alone edit usually so much better with your and you re my bad
went to therapy for depression therapist wouldnt stop insisting was closeted lesbian,literally just block him weirdo if you say you arent attracted to girls then its more than likely true and even if you are its not his place or his business to try and tell you that you are if you say no therapy is choice and its up to you if you want to go to another therapist but would heavily reccomend blocking him and not even giving him the time of day
why can just be loved,went through the same thing dude an ex of mine just broke up one day and told me he didn love me anymore out of nowhere cried and cried for months wondering what wrong with me thought was hopeless and unloveable but suddenly stopped thinking about him stopped stalking him on social media suddenly they were nothing to me and think my academic load was one of the things that helped me forget about him was too anxious and stressed out about failing my classes that just kept my heartbreak in box somewhere in my brain and eventually forgot about it we all want to be loved being loved is wonderful thing promise you that you ll find someone better soon and you ll forget about her it ll take time to get over the pain but you will promise we re here for you
whenever someone is upset with me want to die,get like this my brain just assumes people are mad at me for the slightest little thing too the downward spiral is more falling straight down hole because see the relationships falling apart theyll never talk to me again and ll die alone and convince myself life isnt worth living if thats the case very exhausting
really want affection but nobody can give what want,know how you feel is there chance to get back together if not then the more you remember her with regret and longing instead of reframing the memories as nostalgia or appreciation the deeper this is going to get no attack or judgement meant btw ve been through this several times is the introversion big part of why its hard to meet others or is work the bigger issue do you think
just want to feel something for once,me too fucking tired of the anhedonic episodes where feel like falling out of love with music which is essentially who fuckin am tired of the episodes of feeling like wanna sell all my guitars and amps and like gonna puke if touch the fuckin thing with ten foot pole
am quitting my job without anything lined up and just want to vent,dont quit if you quit you will be denied unemployment insurance either dont show up and let them fire you or go in and do the bare minimum there is massive rescission looming over the world right now if you quit voluntarily you would be hard pressed to find future employment unemployment insurance at least allows you safety net
anyone else genuinely blame themselves for their own depression or is it just me,dont know how either and ve been trying since was teenager thats like years ago
wasted the last years,wasted the last myself you aint alone friend
my dads been getting upset with me because have been sleeping lot and not eating too much,hmm any possibilities for you to move out being depressed is fucking hard as it is you dont need anybody to make life any harder
should see therapist,yes if you can afford it for sure you will tell them the toxic things that come up in your mind you dont need name for whats wrong with you you need someone to listen and help you sort through your thoughts
tried overdosing didnt have enough pills,thats ok just hope you dont continue to take this personally because it sounds like your friends are backstabber egotists and that doesnt necessitate you harming yourself in the slightest bud
people think simple minded and lazy,know what you mean have you had any success in confronting the source of this anxiety thoughts situations etc either with professional or on your own it was bad for me for years too
such fucking hypocrite,pushing away is very common response when it comes to depression it is just one of many self destructive responses and you dont have to feel bad about it what matters is recognizing it as something you want to improve and start to focus on it more it can be difficult you may feel like burden to the person trying to get close but this isnt something that you have to suffer through alone do your best to accept the help when people offer it make sure to be appreciative but try to accept it rather than declining you may see an improvement for both of you
living for other people can anyone relate any advice,the medical profession is brutal went into the trades and honestly feel like its saved my life few times found something that better than most people at doing its the only area of my life that dont hate myself over plus the money is above average easier said than done to find something that you feel confident doing much less something you enjoy to some degree but at you should try jobs year see what you actually like this is your whole life youre trying to figure out if you pick high stress job you felt pressured to pursue it could literally be the death of you
let help one another,just went on and off of my baby mg dose of sertraline bc was feeling low and then things got so much worse after about week back on it trying to pull it together find things that spark joy but things have been feeling pretty lonely lately thanks for your post and the reminders self care is hard but self care is important
some asshole messaged me on here asking me what sucked from my previous post suck,what assholes ask for sexual favors on depresion forum just dont get it
sertraline mg and worsening headaches,from what understand it not the best idea to go right back to the dose you were on before tapering know had to build up to mg before eventually tapered off sertraline rule of thumb is to start on lower dose even if you were on higher one because these are meant to affect your brain kind of how person who gets out of rehab and goes back to drugs is more likely to overdose by trying the amount they used before but the brain has adjusted to not using that much and isn used to it overdose definitely talk to your doctor about it you should always talk about problematic symptoms and you might want to mention that you didn get these before and that pain meds aren working
feel like the only reason alive is so can die one day,if wana talk to someone here for you
only the good die young,what an amazing way to die instant painless
anyone here get brain fog too,yes have it too and massive derealization can listen to my favourite music and feel completely nothing need to manually tell my brain supposed to nod to the rythm
an asocial uninteresting boring ass fucker,when can you move out from your parents house and start living the good personality you choose bud wasnt able to start getting better in my mental health or social skill until was moved out of my rotten childhood home and away from the misery there
tired of being gray,can you write any music that encapsulates what it like to be in this area this gray area is there anything that you can write that describes what it like to be like this
happy thanksgiving,thanks ima get stoned and fat af today its good day
my dad is in the hospital in serious condition and feel totally locked emotionally and unable for action,man can relate to this couple of years ago my dad got really sick of some bacterial infection and just froze in place when went to see him at the hospital really think he was going to die and just stand there without knowing what to say or do and he just laught at me because he knew am not the best at stressfull situations and then laught with him since then feel lot closer to my dad he recover hope your dad recover as well and sorry for my bad english
cant stop eating help,open you tube type in overeating there are several helpful videos for you they will help you develop strategy
what are reasons not to end my life,it going to vary for different people ll give you some of mine my parents are elderly my death could kill them my son is autistic and the only one who works with him and helps him my group yes game allows me to get together with friends and not be myself for hours week also break things into time cycles stuff like see the next james bond movie make it to the judas priest concert have tickets for these ones are important too hit the marker and don feel bad for months after
slow suicide,good for you hope you and your wife live long and happy lives
doing homework makes me feel so much worse,feel like lots of parents lack the empathy to understand our struggles as students they always blame our phones or computers but never understand the amount of bullshit schools and colleges make us go through trust me ever since this pandemic hit ve been more and more depressed what also sucks is that most going to fail class this semester and scared of telling my parents its very hard time indeed idk about advice but just know if you want to talk here
does anything exist,maybe nothing does matter but then again that just means that whatever you think matters actually does matter its weird concept
struggling to keep up with her feelings,fix what you can fake the rest rome wasn built in day so it ll take time start with what you can and build up to cover up what you can this is perhaps going to be the best thing you can possibly do acquire sense of commitment buy fish fairly cheap pet to up keep and build routine not yet qualified to be therapist but going for phd in different field of psychology it overlaps with therapy use the fake it till you make it slogan nothing is easy but give yourself reason to feel down work for goal and when you can achieve the goal then allow yourself to feel down only to get back up it tiring journey but you aren alone
im left behind,imo go back to the psychiatrist and see why it isn working he might need to revise the combination of what rx or maybe go to counseling with psychologist
wish was priority to someone,you should talk to your boyfriend or family because honestly it helps get their perspectives because you might already be priority but life can keep anyone busy good luck to you
just trying to leave the house to the grocery store,there was time where couldn either and my therapist taught me to look at it differently like instead of looking at the entire picture going grocery shopping would look at the first step only getting in the car and if accomplished that would look at the next step driving to the store things just get very emotionally overwhelming and not sure if this would work for you but thought share oh and she also told me that even if don make it to the overall goal should still look at the goals accomplished along the way and acknowledge my success in completing them hope this can be of service to you
dating is hard when you have no real ambition in life,wouldnt date boring person like me why would anyone else
anyone else hurt themselves with unrealistic optimism,fucking exactly the same process happens me ve tried to go in between the unrealistic optimism and depressive realism and the end result is always just settling for what could get but never feels like enough everyone has difference of opinion in what is considered just enough for themselves and finding what that looks like for yourself is process and rn just starting it let me know what the doctor says because this feels very complex
idk what happening,did something happen to make this feeling come around family trouble work issues friend fight dark thoughts if there are dark thoughts aside from the desire to die what are they saying
just saw hamilton and it destroyed me,hey there literally just finishing schitt creek not pop culture fanatic but holy schitt right now am feeling exactly how you are feeling after watching this show fuck if am honest feel like this quite often humans can be so ugly but so many are what call super human it is debilitating to have so much appreciation and recognition for the world and yet be so not player everyone is fucking hero as compared fuck admire the person bagging groceries at the super market that person has done more for the world then have crazy timing on your post
how am supposed to love myself when ve done myself so much harm,what kind of harm have you done bud can you make recompense or apologize to the ones you hurt
craving isolation,thats what do but the worlds calling me
dont know if ll make it to,thats good dream to have have you had any success in collecting email addresses physical addresses and other info to find new and better work bud this virus has smacked whole bunch of people down and know it sucks right royally
anybody else depression anxiety headaches and fatigue waaaay worse in the morning but at nighttime you kind of level off and aren in complete agony,dont know about the not being in pain part but pretty much like vampire or something in the sense that sleep through the day and just fuckin knackered in daylight but once it gets dark start waking up whenever try and sometimes even succeed in correcting my sleeping schedule before longit just falls right back into place of being pretty much completely nocturnal
